{
	"$schema": "http://json-schema.org/draft-07/schema#",
	"properties": {
		"craft": {
			"properties": {
				"cost": {
					"type": "number"
				},
				"items": {
					"items": {
						"properties": {
							"amount": {
								"type": "number"
							},
							"id": {
								"type": "string"
							},
							"name": {
								"type": "string"
							}
						},
						"required": ["amount", "id", "name"],
						"type": "object"
					},
					"type": "array"
				}
			},
			"required": ["cost", "items"],
			"type": "object"
		},
		"days": {
			"items": {
				"type": "string"
			},
			"type": "array"
		},
		"description": {
			"type": "string"
		},
		"domain": {
			"type": "string"
		},
		"id": {
			"type": "string"
		},
		"location": {
			"type": "string"
		},
		"name": {
			"type": "string"
		},
		"rarity": {
			"type": "number"
		},
		"source": {
			"items": {
				"type": "string"
			},
			"type": "array"
		},
		"version": {
			"type": "string"
		}
	},
	"required": [
		"days",
		"description",
		"domain",
		"id",
		"location",
		"name",
		"rarity",
		"source",
		"version"
	],
	"type": "object",
	"additionalProperties": false
}
