{
  "id": "TeachingsOfEquity",
  "name": "Insegnamenti di equità",
  "description": "L'equità è il confine della Nazione dell'Acqua. L'equità pone limiti ai diritti. Senza equità, i diritti concessi dalla legge verrebbero abusati e diventerebbero uno strumento per danneggiare le nostre virtuose tradizioni.",
  "source": [
    "Si acquista nel Negozio di regali"
  ],
  "location": "Mondstadt",
  "rarity": 2,
  "domain": "Tenue gloria dimenticata",
  "days": [
    "Lunedì",
    "Giovedì",
    "Domenica"
  ],
  "version": "4.0"
}