{
  "id": "SilverGobletOfThePristineSea",
  "name": "Серебряный кубок непорочного моря",
  "description": "Во времена, когда золотой саван покрывал землю, чистую родниковую воду приходилось прятать в потаённых горных ручьях. В этих святилищах и рождались Рыцари чистых родников. Рыцари поклялись серебряными доспехами защищать духов, рождённых из чистой воды, защищать своих собратьев, которые тоже хранят веру в единую истинную купель, противостоящую вездесущей золотой силе, запятнавшей небо и затмившей солнце. Но это лишь древняя легенда... Вскоре после того, как империя рухнула и канула в Лету, рыцари, противостоявшие тирану, сбросили свои доспехи, а их истории были запрятаны в запутанной паутине сказаний и баллад.",
  "source": [
    "Алхимия"
  ],
  "location": "Фонтейн",
  "rarity": 4,
  "craft": {
    "cost": 350,
    "items": [
      {
        "id": "WineGobletOfThePristineSea",
        "name": "Чаша непорочного моря",
        "amount": 3
      }
    ]
  },
  "domain": "Эхо глубоких приливов",
  "days": [
    "Среда",
    "Суббота",
    "Воскресенье"
  ],
  "version": "4.0"
}