{
  "id": "TeachingsOfProsperity",
  "name": "Учения о «Процветании»",
  "description": "Процветание - это стремление царства земли. Процветание - это благословение Ли Юэ, великого города, основанного богами и людьми, это источник мира на земле.",
  "source": [
    "Сувенирная лавка"
  ],
  "location": "Мондштадт",
  "rarity": 2,
  "domain": "Тайшаньфу",
  "days": [
    "Понедельник",
    "Четверг",
    "Воскресенье",
    "Понедельник",
    "Четверг",
    "Воскресенье"
  ],
  "version": "5.0"
}