{
  "id": "FragmentOfDecarabiansEpic",
  "name": "Fragment of Decarabian's Epic",
  "description": "Andrius นั้นครั้งหนึ่งเคยประกาศสงครามกับ Hightower Uniking แต่ก็ไม่สามารถทำอะไรได้แม้แต่จะสร้างความเสียหายให้แก่เมือง ถ้าไม่ใช่เพราะเพื่อบทเพลงแห่งอิสรภาพที่ทำให้เมืองแตกออกเป็นเสี่ยง ๆ แล้วล่ะก็ ฝันนี้ก็จะคงอยู่ไปตลอดกาล",
  "source": [
    "ได้รับจากการสรรสร้าง"
  ],
  "location": "Mondstadt",
  "rarity": 4,
  "craft": {
    "cost": 350,
    "items": [
      {
        "id": "DebrisOfDecarabiansCity",
        "name": "Debris of Decarabian's City",
        "amount": 3
      }
    ]
  },
  "domain": "สวนดอก Cecilia",
  "days": [
    "วันจันทร์",
    "วันพฤหัสบดี",
    "วันอาทิตย์"
  ],
  "version": "1.6"
}