{
  "id": "BrokenGobletOfThePristineSea",
  "name": "Saf Denizin Kırık Kadehi",
  "description": "Efsanelere göre İlk Taht Hırsızı Ezeli Deniz'e geldiğinde ilk Hükümdar ona bir kupa su verdi. Daha sonra o mutlak Tanrı Kral haline geldi, bu suyu gizemli çiy damlacıklarını arıtmak için kullandı ve bu sayede muhteşem ve güçlü bir imparatorluk oluşturdu. Fakat bu artık kadim bir hikayeden ibaret ve karakterler derin sularda yaşayan balık sürülerinin saçtığı ışıkların arasında uyumakta.",
  "source": [
    "Hediye Dükkanında takas edilir."
  ],
  "location": "Fontaine",
  "rarity": 2,
  "domain": "Derin Dalgaların Yankıları",
  "days": [
    "Çarşamba",
    "Cumartesi",
    "Pazar"
  ],
  "version": "4.0"
}