{
  "id": "PhilosophiesOfElegance",
  "name": "Philosophies of Elegance",
  "description": "Elegance is the form of the nation of thunder.<br/>Elegance abhors vulgarity, and the elegant ever walk alone. Resisting base evils, unmoved by base loves, never taking refuge in base ignorance â€” that is how one perceives the chasm between the elegant and the contemptuous.",
  "source": [
    "Crafted"
  ],
  "location": "Inazuma",
  "rarity": 4,
  "craft": {
    "cost": 550,
    "items": [
      {
        "id": "GuideToElegance",
        "name": "Guide to Elegance",
        "amount": 3
      }
    ]
  },
  "domain": "Violet Court",
  "days": [
    "Tuesday",
    "Friday",
    "Sunday"
  ],
  "version": "5.0"
}