{
  "id": "GuideToAdmonition",
  "name": "Guide to Admonition",
  "description": "Admonition is the branches of the nation of wisdom. Admonition is paired with wise thinking. Careful deliberation affords humble words a clarity that convinces the wise and enlightens the foolish. Such words allow wisdom to flow like an unobstructed river.",
  "source": [
    "Crafted"
  ],
  "location": "Sumeru",
  "rarity": 3,
  "craft": {
    "cost": 175,
    "items": [
      {
        "id": "TeachingsOfAdmonition",
        "name": "Teachings of Admonition",
        "amount": 3
      }
    ]
  },
  "domain": "Steeple of Ignorance",
  "days": [
    "Monday",
    "Thursday",
    "Sunday"
  ],
  "version": "3.0"
}